{
  "$schema": "docs/capability-schema-v0.json",
  "id": "gpmc.author_folder_redirection",
  "surface": "gpmc-server2025",
  "revision": 2,
  "gpo_transaction": true,
  "run_sheet": "gpmc.author_folder_redirection",
  "intent": "Author one Basic-mode Documents folder-redirection rule with non-default option flags on a disposable GPO through the Folder Redirection snap-in, so the empty fdeploy.ini marker and semantic fdeploy1.ini payload under User\\Documents & Settings, their keying, and the option-flag encoding can be read off the capture.",
  "parameters": {
    "type": "object",
    "additionalProperties": false,
    "required": ["gpo_name", "domain_dns", "root_path"],
    "properties": {
      "gpo_name": { "type": "string" },
      "domain_dns": { "type": "string" },
      "root_path": { "type": "string" }
    }
  },
  "channel_contract": {
    "setup": ["powershell"],
    "operation_under_test": ["gpmc_ui"],
    "orientation": ["uia", "hwnd", "screenshot"],
    "input_delivery": ["helper_input", "hyperv_input"],
    "oracle": ["gpo_observers"],
    "cleanup": ["powershell", "programmatic_requery"]
  },
  "first_commit_point": "ok_folder_redirect_dialog",
  "fact_plan": {
    "observers": [
      {"name": "r2_core", "params": {}},
      {"name": "fdeploy_marker", "params": {"relpath": "User\\Documents & Settings\\fdeploy.ini"}},
      {"name": "fdeploy_ini", "params": {"relpath": "User\\Documents & Settings\\fdeploy1.ini"}}
    ]
  },
  "envelope": {
    "require": [
      {
        "fact": "fdeploy_marker",
        "predicate": "post.fdeploy_marker.present == True and post.fdeploy_marker.encoding.bom == 'utf16le' and post.fdeploy_marker.encoding.crlf_only == True and post.fdeploy_marker.section_count == 0 and post.fdeploy_marker.entry_count == 0"
      },
      {
        "fact": "fdeploy",
        "predicate": "post.fdeploy.present == True"
      },
      {
        "fact": "fdeploy.encoding",
        "predicate": "post.fdeploy.encoding.crlf_only == True"
      },
      {
        "fact": "fdeploy.entries_present",
        "predicate": "post.fdeploy.section_count == 3 and post.fdeploy.entry_count == 4"
      },
      {
        "fact": "fdeploy.section_names.1",
        "predicate": "post['fdeploy.section_names.1'] == 'Folder_Redirection'"
      },
      {
        "fact": "fdeploy.entries.0",
        "predicate": "post['fdeploy.entries.0.key'] == 'version' and post['fdeploy.entries.0.value'] == '100'"
      },
      {
        "fact": "fdeploy.entries.2",
        "predicate": "post['fdeploy.entries.2.key'] == 'Flags' and post['fdeploy.entries.2.value'] == '1021'"
      },
      {
        "fact": "fdeploy.entries.3",
        "predicate": "post['fdeploy.entries.3.key'] == 'FullPath' and args['root_path'] in post['fdeploy.entries.3.value'] and '%USERNAME%' in post['fdeploy.entries.3.value']"
      },
      {
        "fact": "ad.gPCUserExtensionNames",
        "predicate": "'{25537BA6-77A8-11D2-9B6C-0000F8080861}' in post.ad.gPCUserExtensionNames and '{88E729D6-BDC1-11D1-BD2A-00C04FB9603F}' in post.ad.gPCUserExtensionNames"
      }
    ],
    "allow": [
      { "category": "timestamps" },
      { "category": "replication_metadata" },
      { "category": "file_mtime" }
    ],
    "forbid": [
      {
        "scope": "ad.gPCMachineExtensionNames",
        "predicate": "'3125E937-EB16-4b4c-9934-544FC6D24D26' not in scope and 'A3CC7818-8A30-4e0c-91C5-A4EA4B5A8DAB' not in scope"
      },
      {
        "scope": "scope.sysvol_contained",
        "predicate": "scope == True"
      },
      {
        "scope": "scope.policies.gpc_guids",
        "predicate": "scope == pre.scope.policies.gpc_guids"
      }
    ],
    "derive": [
      { "relation": "post.version.user > pre.version.user" },
      { "relation": "post.version.machine == pre.version.machine" },
      { "relation": "post.version.ad_versionNumber == pre.version.ad_versionNumber + 65536" },
      { "relation": "post.version.raw != pre.version.raw" },
      { "relation": "post.ad.versionNumber == pre.ad.versionNumber + 65536" },
      { "relation": "post.scope.extension_lists.user != pre.scope.extension_lists.user" },
      { "relation": "post.scope.sysvol_relpaths != pre.scope.sysvol_relpaths" }
    ],
    "convergence": { "window_seconds": 120, "poll_seconds": 6, "reproduce": 2 }
  },
  "structured_checks": [
    {
      "id": "root_path_recorded_verbatim",
      "checks": "The FullPath entry is required to contain the authored root path and %USERNAME%; the qualification record carries the complete measured value for exact review."
    },
    {
      "id": "option_flags_recorded",
      "checks": "The measured semantic payload requires Flags=1021 for exclusive rights off, move contents on, and redirect-back-on-removal."
    },
    {
      "id": "user_shell_folders_absent",
      "checks": "No 'User Shell Folders' artifact appears in the SYSVOL fingerprint (the sysvol per-file facts cover every non-system file; absence of a User Shell Folders file under User\\ is visible there)."
    }
  ],
  "bindings": {
    "args": "Capability arguments are bound into predicates at load time by wcd.exec_transaction.",
    "fact_vocabulary": "fdeploy_marker.* observes the 20-byte fdeploy.ini marker; fdeploy.* observes the semantic fdeploy1.ini payload. Counts support the bounded envelope; ordered section names and entry-level facts are dotted per index."
  },
  "cleanup": {
    "strategy": "backup_then_remove_gpo",
    "requery": "strict_absence",
    "residual_accounting": true
  },
  "recovery": {
    "kind": "checkpoint_revert",
    "demonstration": "estate baseline checkpoint existence asserted at prepare"
  }
}
